{
  "$schema": "https://json-schema.org/draft/2020-12/schema",
  "$id": "https://neoproc.com/financialagent/schemas/payroll-submit-result.v1.json",
  "title": "PayrollSubmitResult v1",
  "description": "Result of a target-portal submit Service Task. Carries totals reconciliation, the per-employee row diff (roster_diff) that drives BPM lifecycle subprocesses, and portal-issued submission proof.",
  "type": "object",
  "required": ["schema", "envelope", "task", "result", "audit"],
  "additionalProperties": false,
  "properties": {
    "schema": { "const": "payroll-submit-result.v1" },

    "envelope": { "$ref": "https://neoproc.com/financialagent/schemas/payroll-capture-result.v1.json#/properties/envelope" },

    "task": {
      "type": "object",
      "required": ["type", "operation", "targetPortal"],
      "additionalProperties": false,
      "properties": {
        "type":         { "const": "PAYROLL_SUBMIT" },
        "operation":    { "type": "string", "enum": ["SUBMIT_SALARIES", "SUBMIT_RENTA_DECLARATION"] },
        "targetPortal": { "type": "string", "enum": ["ccss-sicere", "ins-rt-virtual", "hacienda-ovi", "mock-payroll"] },
        "sourceCaptureEnvelopeId": { "type": "string", "format": "uuid" },
        "clientIdentifier": { "type": "string",
          "description": "Echoed from the submit-request for shared-creds and per-client portals; absent for per-firm portals." }
      }
    },

    "encryption": { "$ref": "https://neoproc.com/financialagent/schemas/payroll-capture-result.v1.json#/$defs/Encryption" },

    "result": {
      "oneOf": [
        { "$ref": "#/$defs/SubmitResultBody" },
        { "type": "string", "pattern": "^vault:v\\d+:" }
      ]
    },

    "audit": { "$ref": "https://neoproc.com/financialagent/schemas/payroll-capture-result.v1.json#/$defs/Audit" }
  },

  "$defs": {
    "SubmitResultBody": {
      "type": "object",
      "required": ["status", "totals", "submittedRows", "roster_diff"],
      "additionalProperties": false,
      "properties": {
        "status": { "type": "string", "enum": ["SUCCESS", "PARTIAL", "MISMATCH", "FAILED"] },

        "portalConfirmation": {
          "type": ["object", "null"],
          "description": "Portal-issued submission proof (CCSS planilla id, INS contribution id, Hacienda submission ref). Null when submission did not reach a confirmation.",
          "additionalProperties": false,
          "properties": {
            "id":        { "type": "string" },
            "issuedAt":  { "type": "string", "format": "date-time" },
            "rawText":   { "type": "string" }
          }
        },

        "totals": {
          "type": "object",
          "required": ["currency", "grandTotal", "updatedCount"],
          "additionalProperties": false,
          "properties": {
            "currency":   { "type": "string", "pattern": "^[A-Z]{3}$" },
            "grandTotal": {
              "$ref": "https://neoproc.com/financialagent/schemas/payroll-capture-result.v1.json#/$defs/Money",
              "description": "Post-submit grand total visible on the portal (sum of all salaries, changed and unchanged). Reconciles against the sum of all salaries pulled from the source-of-truth; any drift flips the run to MISMATCH, with rosterDiff naming the employees that explain the gap."
            },
            "updatedCount": { "type": "integer", "minimum": 0,
                              "description": "Diagnostic: how many rows the agent actually changed on this submit. Not used for reconciliation." },
            "expected": {
              "oneOf": [
                { "type": "null" },
                { "$ref": "https://neoproc.com/financialagent/schemas/payroll-capture-result.v1.json#/$defs/Money" }
              ],
              "description": "Sum of every canonical-input salary the run intended to put on the portal. Surfaced as a process variable for BPMN gating: 'expected != grandTotal' (or 'expected != portalReported' on portals that distinguish working from reported totals) is the deterministic mismatch signal. Optional; older capture-only adapters omit it."
            },
            "portalReported": {
              "oneOf": [
                { "type": "null" },
                { "$ref": "https://neoproc.com/financialagent/schemas/payroll-capture-result.v1.json#/$defs/Money" }
              ],
              "description": "Portal's reported/saved salaries total — distinct from grandTotal on portals that distinguish a working/draft total from a saved/reported total (CCSS Sicere's 'Total de Salarios Reportados'). Optional; portals without that distinction leave it null."
            }
          }
        },

        "submittedRows": {
          "type": "array",
          "description": "Rows the agent actually filled and submitted. One entry per matched canonical employee.",
          "items": {
            "type": "object",
            "required": ["id", "displayName", "salary"],
            "additionalProperties": false,
            "properties": {
              "id":          { "type": "string" },
              "displayName": { "type": "string" },
              "salary":      { "$ref": "https://neoproc.com/financialagent/schemas/payroll-capture-result.v1.json#/$defs/Money" }
            }
          }
        },

        "roster_diff": {
          "type": "object",
          "required": ["missingFromPortal", "missingFromPayroll"],
          "additionalProperties": false,
          "description": "Per-target reconciliation. Drives BPM lifecycle subprocesses (register hires, deregister terminations) when status=PARTIAL.",
          "properties": {
            "missingFromPortal": {
              "type": "array",
              "description": "In source payroll, not found on target portal. Each entry is a likely new-hire registration candidate.",
              "items": {
                "type": "object",
                "required": ["id", "name"],
                "additionalProperties": false,
                "properties": {
                  "id":             { "type": "string" },
                  "name":           { "type": "string" },
                  "expectedSalary": { "$ref": "https://neoproc.com/financialagent/schemas/payroll-capture-result.v1.json#/$defs/Money" },
                  "attributes":     { "type": "object", "additionalProperties": { "type": "string" } }
                }
              }
            },
            "missingFromPayroll": {
              "type": "array",
              "description": "On target portal, not in source payroll. Each entry is a likely deregistration candidate. Confirm before acting — terminations are high-risk.",
              "items": {
                "type": "object",
                "required": ["id", "displayName"],
                "additionalProperties": false,
                "properties": {
                  "id":              { "type": "string" },
                  "displayName":     { "type": "string" },
                  "lastKnownSalary": {
                    "oneOf": [
                      { "type": "null" },
                      { "$ref": "https://neoproc.com/financialagent/schemas/payroll-capture-result.v1.json#/$defs/Money" }
                    ]
                  }
                }
              }
            }
          }
        },

        "errorDetail": {
          "type": ["object", "null"],
          "description": "Populated when status=FAILED. Engineering escalation path uses this to triage.",
          "additionalProperties": false,
          "properties": {
            "errorClass":   { "type": "string",
                              "description": "Either a coarse classification (TRANSIENT|PERMANENT) or the fully-qualified Java class of the originating component, depending on producer." },
            "category":     { "type": "string",
                              "enum": ["NETWORK", "SELECTOR", "CREDENTIALS", "PORTAL_REJECTED",
                                       "DUPLICATE_ENVELOPE", "UNCAUGHT_EXCEPTION", "SCHEMA_VIOLATION",
                                       "OTHER",
                                       "CREDENTIALS_INVALID", "CREDENTIALS_EXPIRED",
                                       "PORTAL_UNREACHABLE", "PORTAL_AUTH_BLOCKED",
                                       "UNEXPECTED"],
                              "description": "Adapter-emitted categories follow the §15.5 vocabulary: CREDENTIALS_INVALID (login rejected), CREDENTIALS_EXPIRED (login forced password change), PORTAL_UNREACHABLE (network/DNS/timeout), PORTAL_AUTH_BLOCKED (CAPTCHA / step-up / anti-bot), UNEXPECTED (anything else). The remaining values are listener-side categories (DUPLICATE_ENVELOPE, UNCAUGHT_EXCEPTION, SCHEMA_VIOLATION) and pre-§15 worker-side categories (NETWORK, SELECTOR, CREDENTIALS, PORTAL_REJECTED, OTHER) kept for backwards compatibility. New adapters should use the §15.5 values." },
            "message":      { "type": "string" }
          }
        },

        "review": {
          "type": ["object", "null"],
          "description": "Populated for MISMATCH/PARTIAL runs. Renders in the Praxis HITL task form: signals shown grouped by type, allowedActions rendered as buttons.",
          "additionalProperties": false,
          "required": ["severity", "summary"],
          "properties": {
            "severity":       { "type": "string", "enum": ["INFO", "WARN", "ERROR"] },
            "summary":        { "type": "string" },
            "signals":        {
              "type": "array",
              "items": {
                "type": "object",
                "additionalProperties": false,
                "required": ["type"],
                "properties": {
                  "type":            { "type": "string",
                                       "enum": ["TOTAL_GAP", "MISSING_FROM_PORTAL", "MISSING_FROM_PAYROLL",
                                                "NAME_DRIFT"] },
                  "canonical":       {
                    "oneOf": [
                      { "type": "null" },
                      { "$ref": "https://neoproc.com/financialagent/schemas/payroll-capture-result.v1.json#/$defs/Money" }
                    ],
                    "description": "Canonical-side amount for TOTAL_GAP signals. Money — accepts JSON string (canonical wire form) or JSON number (Jackson default for BigDecimal); both equivalent on the wire."
                  },
                  "portal":          {
                    "oneOf": [
                      { "type": "null" },
                      { "$ref": "https://neoproc.com/financialagent/schemas/payroll-capture-result.v1.json#/$defs/Money" }
                    ],
                    "description": "Portal-side amount for TOTAL_GAP signals. Money — string or number."
                  },
                  "gap":             {
                    "oneOf": [
                      { "type": "null" },
                      { "$ref": "https://neoproc.com/financialagent/schemas/payroll-capture-result.v1.json#/$defs/Money" }
                    ],
                    "description": "portal - canonical, signed. Money — string or number."
                  },
                  "id":              { "type": ["string", "null"] },
                  "name":            { "type": ["string", "null"],
                                       "description": "Canonical (source-of-truth) employee name. For NAME_DRIFT, paired with portalName to surface the disagreement." },
                  "portalName":      { "type": ["string", "null"],
                                       "description": "Portal-side employee name. Populated for NAME_DRIFT signals so HITL can compare against the canonical name." },
                  "expectedSalary":  {
                    "oneOf": [
                      { "type": "null" },
                      { "$ref": "https://neoproc.com/financialagent/schemas/payroll-capture-result.v1.json#/$defs/Money" }
                    ],
                    "description": "Expected salary for MISSING_FROM_PORTAL signals. Money — string or number."
                  },
                  "lastKnownSalary": {
                    "oneOf": [
                      { "type": "null" },
                      { "$ref": "https://neoproc.com/financialagent/schemas/payroll-capture-result.v1.json#/$defs/Money" }
                    ]
                  }
                }
              }
            },
            "allowedActions": {
              "type": "array",
              "items": { "type": "string" }
            }
          }
        }
      }
    }
  }
}
