{
  "schema": "payroll-submit-result.v1",
  "envelope": {
    "envelopeId": "33333333-4444-5555-6666-777777777777",
    "businessKey": "2026-01::1051",
    "firmId": 1351,
    "locale": "es",
    "createdAt": "2026-04-27T20:11:35.000Z",
    "issuer": "agent-worker/mock-payroll",
    "issuerRunId": "20260427T201135-aaaaa"
  },
  "task": {
    "type": "PAYROLL_SUBMIT",
    "operation": "SUBMIT_SALARIES",
    "targetPortal": "mock-payroll",
    "sourceCaptureEnvelopeId": "d9f5a846-fa8c-4078-aa22-2019cd2e2388"
  },
  "encryption": {
    "scheme": "kms-envelope-v1",
    "keyName": "payroll-firm-1351",
    "keyVersion": 1,
    "ciphertextField": "result"
  },
  "result": "kms:v1:AAAAAAAAAAAAAAAAAAAAAA==.BBBBBBBBBBBBBBBBBBBBBBBBBBBBBBBBBBBBBBBBBBBBBBBBBBBBBBBBBBBBBBBBBBBBBBBBBBBBBBBBBBBBBBBBBBBBBBBBBBBBBBBBBBBBBBBBBBBBBBBBBBBBBBBBBBBB==",
  "audit": {
    "payloadSha256": "0000000000000000000000000000000000000000000000000000000000000002"
  }
}
